{
  "specversion": "1.0",
  "id": "evt-SYNTHETIC_QA_01-7-1-0",
  "source": "urn:nexoai:camera:SYNTHETIC_QA_01",
  "type": "com.nexoai.safety.ppe.violation.v2",
  "time": "2026-01-01T00:00:00.700Z",
  "datacontenttype": "application/json",
  "dataschema": "https://nexoai.example/contracts/v2/event.schema.json",
  "subject": "track/1",
  "contractversion": "2.0.0",
  "data": {
    "contract_version": "2.0.0",
    "frame_id": 7,
    "monotonic_timestamp_ms": 700,
    "track_id": 1,
    "status": "Falta: Gloves",
    "confidence": 0.9,
    "ppe": null,
    "evidence": []
  }
}
